<?xml version="1.0" encoding="UTF-8"?>
<!-- edited with XMLSpy v2019 (x64) (http://www.altova.com) by Bogdan Vesovic (SIEMENS INDUSTRY INC. EM DG SW&C SW) -->
<!--Sample XML file generated by XMLSpy v2017 sp2 (x64) (http://www.altova.com)-->
<m:ExportResults xmlns:xsi="http://www.w3.org/2001/XMLSchema-instance" xmlns:m="http://www.siemens.com/soa/ExportResults.xsd" xsi:schemaLocation="http://www.siemens.com/soa/ExportResults.xsd file:///ExportResults.xsd">
	<m:ExportResultsType Name="MPRegionalSummary">
		<m:ResultsSummary>
			<m:Header>
				<m:HeaderElement>
					<m:Name>NoOfRows</m:Name>
					<m:DataType>int</m:DataType>
					<m:DataLength>4</m:DataLength>
				</m:HeaderElement>
				<m:HeaderElement>
					<m:Name>NoOfColumns</m:Name>
					<m:DataType>int</m:DataType>
					<m:DataLength>4</m:DataLength>
				</m:HeaderElement>
			</m:Header>
			<m:Body>
				<m:Column>
					<m:Name>RUN_TIME</m:Name>
					<m:DataType>long</m:DataType>
					<m:DataLength>32</m:DataLength>
				</m:Column>
				<m:Column>
					<m:Name>TIME_INTERVAL</m:Name>
					<m:DataType>long</m:DataType>
					<m:DataLength>32</m:DataLength>
					<m:Addons>
						<m:Functions>
							<m:Name>ADD_5MIN</m:Name>
						</m:Functions>
					</m:Addons>
				</m:Column>
				<m:Column>
					<m:Name>MKT_TYPE</m:Name>
					<m:DataType>string</m:DataType>
					<m:DataLength>32</m:DataLength>
				</m:Column>
				<m:Column>
					<m:Name>REGION_NAME</m:Name>
					<m:DataType>string</m:DataType>
					<m:DataLength>32</m:DataLength>
				</m:Column>
				<m:Column>
					<m:Name>COMMODITY_TYPE</m:Name>
					<m:DataType>string</m:DataType>
					<m:DataLength>2</m:DataLength>
				</m:Column>
				<m:Column>
					<m:Name>MKT_REQT</m:Name>
					<m:DataType>double</m:DataType>
					<m:DataLength>32</m:DataLength>
				</m:Column>
				<m:Column>
					<m:Name>LOAD_BID</m:Name>
					<m:DataType>double</m:DataType>
					<m:DataLength>32</m:DataLength>
				</m:Column>
				<m:Column>
					<m:Name>CURTAILED_LOAD</m:Name>
					<m:DataType>double</m:DataType>
					<m:DataLength>32</m:DataLength>
				</m:Column>
				<m:Column>
					<m:Name>MW_LOSSES</m:Name>
					<m:DataType>double</m:DataType>
					<m:DataLength>32</m:DataLength>
				</m:Column>
				<m:Column>
					<m:Name>GENERATION</m:Name>
					<m:DataType>double</m:DataType>
					<m:DataLength>32</m:DataLength>
				</m:Column>
				<m:Column>
					<m:Name>MW_IMPORT</m:Name>
					<m:DataType>double</m:DataType>
					<m:DataLength>32</m:DataLength>
				</m:Column>
				<m:Column>
					<m:Name>MW_EXPORT</m:Name>
					<m:DataType>double</m:DataType>
					<m:DataLength>32</m:DataLength>
				</m:Column>
			</m:Body>
		</m:ResultsSummary>
	</m:ExportResultsType>
	<m:ExportResultsType Name="MPReserveSchedule">
		<m:ResultsSummary>
			<m:Header>
				<m:HeaderElement>
					<m:Name>NoOfRows</m:Name>
					<m:DataType>int</m:DataType>
					<m:DataLength>4</m:DataLength>
				</m:HeaderElement>
				<m:HeaderElement>
					<m:Name>NoOfColumns</m:Name>
					<m:DataType>int</m:DataType>
					<m:DataLength>4</m:DataLength>
				</m:HeaderElement>
			</m:Header>
			<m:Body>
				<m:Column>
					<m:Name>RUN_TIME</m:Name>
					<m:DataType>long</m:DataType>
					<m:DataLength>32</m:DataLength>
				</m:Column>
				<m:Column>
					<m:Name>TIME_INTERVAL</m:Name>
					<m:DataType>long</m:DataType>
					<m:DataLength>32</m:DataLength>
				</m:Column>
				<m:Column>
					<m:Name>MKT_TYPE</m:Name>
					<m:DataType>string</m:DataType>
					<m:DataLength>32</m:DataLength>
				</m:Column>
				<m:Column>
					<m:Name>RESOURCE_NAME</m:Name>
					<m:DataType>string</m:DataType>
					<m:DataLength>128</m:DataLength>
				</m:Column>
				<m:Column>
					<m:Name>COMMODITY_TYPE</m:Name>
					<m:DataType>string</m:DataType>
					<m:DataLength>2</m:DataLength>
				</m:Column>
				<m:Column>
					<m:Name>SCHEDULE</m:Name>
					<m:DataType>double</m:DataType>
					<m:DataLength>32</m:DataLength>
				</m:Column>
				<m:Column>
					<m:Name>PRICE</m:Name>
					<m:DataType>double</m:DataType>
					<m:DataLength>32</m:DataLength>
				</m:Column>
			</m:Body>
		</m:ResultsSummary>
	</m:ExportResultsType>
	<m:ExportResultsType Name="MPLMP">
		<m:ResultsSummary>
			<m:Header>
				<m:HeaderElement>
					<m:Name>NoOfRows</m:Name>
					<m:DataType>int</m:DataType>
					<m:DataLength>4</m:DataLength>
				</m:HeaderElement>
				<m:HeaderElement>
					<m:Name>NoOfColumns</m:Name>
					<m:DataType>int</m:DataType>
					<m:DataLength>4</m:DataLength>
				</m:HeaderElement>
			</m:Header>
			<m:Body>
				<m:Column>
					<m:Name>RUN_TIME</m:Name>
					<m:DataType>long</m:DataType>
					<m:DataLength>32</m:DataLength>
				</m:Column>
				<m:Column>
					<m:Name>TIME_INTERVAL</m:Name>
					<m:DataType>long</m:DataType>
					<m:DataLength>32</m:DataLength>
				</m:Column>
				<m:Column>
					<m:Name>MKT_TYPE</m:Name>
					<m:DataType>string</m:DataType>
					<m:DataLength>32</m:DataLength>
				</m:Column>
				<m:Column>
					<m:Name>RESOURCE_NAME</m:Name>
					<m:DataType>string</m:DataType>
					<m:DataLength>32</m:DataLength>
				</m:Column>
				<m:Column>
					<m:Name>LMP</m:Name>
					<m:DataType>double</m:DataType>
					<m:DataLength>32</m:DataLength>
				</m:Column>
			</m:Body>
		</m:ResultsSummary>
	</m:ExportResultsType>
	<m:ExportResultsType Name="DIPCLMP">
		<m:ResultsSummary>
			<m:Header>
				<m:HeaderElement>
					<m:Name>NoOfRows</m:Name>
					<m:DataType>int</m:DataType>
					<m:DataLength>4</m:DataLength>
				</m:HeaderElement>
				<m:HeaderElement>
					<m:Name>NoOfColumns</m:Name>
					<m:DataType>int</m:DataType>
					<m:DataLength>4</m:DataLength>
				</m:HeaderElement>
			</m:Header>
			<m:Body>
				<m:Column>
					<m:Name>TIME_INTERVAL</m:Name>
					<m:DataType>long</m:DataType>
					<m:DataLength>32</m:DataLength>
					<m:Addons>
						<m:Functions>
							<m:Name>ADD_5MIN</m:Name>
						</m:Functions>
					</m:Addons>
				</m:Column>
				<m:Column>
					<m:Name>RESOURCE_NAME</m:Name>
					<m:DataType>string</m:DataType>
					<m:DataLength>32</m:DataLength>
				</m:Column>
				<m:Column>
					<m:Name>AP_FLAG</m:Name>
					<m:DataType>string</m:DataType>
					<m:DataLength>1</m:DataLength>
				</m:Column>
				<m:Column>
					<m:Name>SEC_FLAG</m:Name>
					<m:DataType>string</m:DataType>
					<m:DataLength>1</m:DataLength>
				</m:Column>
				<m:Column>
					<m:Name>PSM_FLAG</m:Name>
					<m:DataType>string</m:DataType>
					<m:DataLength>1</m:DataLength>
				</m:Column>
				<m:Column>
					<m:Name>DIPC_PRICE</m:Name>
					<m:DataType>double</m:DataType>
					<m:DataLength>32</m:DataLength>
				</m:Column>
				<m:Column>
					<m:Name>RTD_PRICE</m:Name>
					<m:DataType>double</m:DataType>
					<m:DataLength>32</m:DataLength>
				</m:Column>
				<m:Column>
					<m:Name>ADMIN_PRICE</m:Name>
					<m:DataType>double</m:DataType>
					<m:DataLength>32</m:DataLength>
				</m:Column>
				<m:Column>
					<m:Name>SEC_PRICE</m:Name>
					<m:DataType>double</m:DataType>
					<m:DataLength>32</m:DataLength>
				</m:Column>
				<m:Column>
					<m:Name>PSM_PRICE</m:Name>
					<m:DataType>double</m:DataType>
					<m:DataLength>32</m:DataLength>
				</m:Column>
			</m:Body>
		</m:ResultsSummary>
	</m:ExportResultsType>
	<m:ExportResultsType Name="TIPCLMP">
		<m:ResultsSummary>
			<m:Header>
				<m:HeaderElement>
					<m:Name>NoOfRows</m:Name>
					<m:DataType>int</m:DataType>
					<m:DataLength>4</m:DataLength>
				</m:HeaderElement>
				<m:HeaderElement>
					<m:Name>NoOfColumns</m:Name>
					<m:DataType>int</m:DataType>
					<m:DataLength>4</m:DataLength>
				</m:HeaderElement>
			</m:Header>
			<m:Body>
				<m:Column>
					<m:Name>TIME_INTERVAL</m:Name>
					<m:DataType>long</m:DataType>
					<m:DataLength>32</m:DataLength>
				</m:Column>
				<m:Column>
					<m:Name>RESOURCE_NAME</m:Name>
					<m:DataType>string</m:DataType>
					<m:DataLength>32</m:DataLength>
				</m:Column>
				<m:Column>
					<m:Name>PRICE</m:Name>
					<m:DataType>double</m:DataType>
					<m:DataLength>32</m:DataLength>
				</m:Column>
			</m:Body>
		</m:ResultsSummary>
	</m:ExportResultsType>
	<m:ExportResultsType Name="RTDReserveSchedule">
		<m:ResultsSummary>
			<m:Header>
				<m:HeaderElement>
					<m:Name>NoOfRows</m:Name>
					<m:DataType>int</m:DataType>
					<m:DataLength>4</m:DataLength>
				</m:HeaderElement>
				<m:HeaderElement>
					<m:Name>NoOfColumns</m:Name>
					<m:DataType>int</m:DataType>
					<m:DataLength>4</m:DataLength>
				</m:HeaderElement>
			</m:Header>
			<m:Body>
				<m:Column>
					<m:Name>TIME_INTERVAL</m:Name>
					<m:DataType>long</m:DataType>
					<m:DataLength>32</m:DataLength>
					<m:Addons>
						<m:Functions>
							<m:Name>ADD_5MIN</m:Name>
						</m:Functions>
					</m:Addons>
				</m:Column>
				<m:Column>
					<m:Name>RESOURCE_NAME</m:Name>
					<m:DataType>string</m:DataType>
					<m:DataLength>128</m:DataLength>
				</m:Column>
				<m:Column>
					<m:Name>COMMODITY_TYPE</m:Name>
					<m:DataType>string</m:DataType>
					<m:DataLength>2</m:DataLength>
				</m:Column>
				<m:Column>
					<m:Name>SCHEDULE</m:Name>
					<m:DataType>double</m:DataType>
					<m:DataLength>32</m:DataLength>
				</m:Column>
				<m:Column>
					<m:Name>PRICE</m:Name>
					<m:DataType>double</m:DataType>
					<m:DataLength>32</m:DataLength>
				</m:Column>
			</m:Body>
		</m:ResultsSummary>
	</m:ExportResultsType>
	<m:ExportResultsType Name="RTDSchedules">
		<m:ResultsSummary>
			<m:Header>
				<m:HeaderElement>
					<m:Name>NoOfRows</m:Name>
					<m:DataType>int</m:DataType>
					<m:DataLength>4</m:DataLength>
				</m:HeaderElement>
				<m:HeaderElement>
					<m:Name>NoOfColumns</m:Name>
					<m:DataType>int</m:DataType>
					<m:DataLength>4</m:DataLength>
				</m:HeaderElement>
			</m:Header>
			<m:Body>
				<m:Column>
					<m:Name>TIME_INTERVAL</m:Name>
					<m:DataType>long</m:DataType>
					<m:DataLength>32</m:DataLength>
					<m:Addons>
						<m:Functions>
							<m:Name>ADD_5MIN</m:Name>
						</m:Functions>
					</m:Addons>
				</m:Column>
				<m:Column>